{
  "protocolVersion": "1.1",
  "command": "install",
  "status": "ok",
  "exitCode": 0,
  "durationMs": 932,
  "artifacts": {
    "resolvedBuildDependencies": "__pyronaut__/resolved-build-dependencies",
    "resolvedRuntimeDependencies": "__pyronaut__/resolved-runtime-dependencies",
    "resolvedTestDependencies": "__pyronaut__/resolved-test-dependencies"
  },
  "warnings": []
}
